{
  "$schema": "https://service.metason.net/saxr/schemas/config.json",
  "description": "Economic situation of US, EU, and CN in 2000-2024.",
  "title": "USD Per Capita",
  "data": {
    "url": "perCapita.json"
  },
  "stage": {
    "width": 0.7,
    "height": 0.55,
    "depth": 0.55
  },
  "sequence": {
    "field": "year",
    "domain": [
      2000,
      2024
    ],
    "arrangement": "comparative",
    "selection": [
      2000,
      2001,
      2006,
      2009,
      2010,
      2015
    ],
    "gap": [
      2,
      2,
      0
    ],
    "columns": 2
  },
  "assetURL": "$SERVER/run/vis/",
  "output": "datareps.json",
  "gridColor": "#66CCFF",
  "bgColor": "#111122CC",
  "palette": {
    "metrical": "Oranges",
    "temporal": "Greys",
    "nominal": "tab10"
  },
  "mark": "box",
  "plot": "bar",
  "encoding": {
    "x": {
      "field": "category"
    },
    "y": {
      "field": "value",
      "scale": {
        "domain": [
          0,
          125000
        ]
      }
    },
    "z": {
      "field": "region"
    },
    "color": {
      "field": "category",
      "title": "per capita in USD"
    }
  },
  "panels": [
    "XY",
    "-XY",
    "Zs",
    "-ZY",
    "XZ",
    "LC=_"
  ],
  "auxReps": [
    {
      "type": "image",
      "x": -0.45,
      "y": 0,
      "z": -0.13640522883309394,
      "w": 0.15,
      "d": 0.1,
      "h": 0,
      "asset": "$SERVER/run/vis/USflag.png"
    },
    {
      "type": "image",
      "x": -0.45,
      "y": 0,
      "z": 0,
      "w": 0.15,
      "d": 0.1,
      "h": 0,
      "asset": "$SERVER/run/vis/EUflag.png"
    },
    {
      "type": "image",
      "x": -0.45,
      "y": 0,
      "z": 0.13640522883309394,
      "w": 0.15,
      "d": 0.1,
      "h": 0,
      "asset": "$SERVER/run/vis/CNflag.png"
    }
  ]
}