{
	"$schema": "https://service.metason.net/saxr/schemas/config.json",
	"description": "3D data viz of Iris data set.",
	"title": "Iris",
	"stage": {
		"width": 0.8,
		"height": 0.8,
		"depth": 0.8
	},
	"data": {
		"url": "iris.json"
	},
	"assetURL": "$SERVER/run/vis/",
	"gridColor": "#DDDE00",
	"bgColor": "#FFFFFF",
	"plot": "scatter",
	"mark": "sphere",
	"encoding": {
		"x": {
			"field": "sepal width"
		},
		"y": {
			"field": "petal length"
		},
		"z": {
			"field": "petal width"
		},
		"size": {
			"value": 0.022
		},
		"color": {
			"field": "class",
			"title": "Iris Classes"
		}
	},
	"panels": ["xy", "-xy", "zy", "-zy", "xz", "lc=_"]
}
